company_description,source,is_edited,created_at,text_lenght,year,month,day,day_of_week,is_weekend,hour
crowdcreate lead crypto nft marketing advisory service trust large company world raise investor fund increase sale create buzz acquire user grow online community make different track record raise million dollar successful client project ve pioneer blockchain marketing work exclusively web firm experience case study prove think leader late marketing growth strategy experience multiple industry crypto nft fintech consumer product ve build proprietary network investor influencer strategic partner help project grow learn watch video httpscrowdcreateus,LinkedIn - Reported,0,2023-10-31 03:51:26,128,2023,10,31,1,0,3
simacan iso certify simacan work large amount information consider great importance inform customer interested party policy procedure information security privacy,website,0,2024-12-21 05:49:13,37,2024,12,21,5,1,5
board manager are manager justin anderson justin anderson vice president are private equity group prior join are associate krg capital partner focus source execute monitor investment,website,0,2024-10-02 02:19:48,44,2024,10,2,2,0,2
kennet equipment leasing star asset finance group star asset finance form july group grow considerably number highprofile acquisition uk kennet equipment leasing base birminghama kennet equipment lease star asset finance group,website,0,2025-01-23 14:37:34,55,2025,1,23,3,0,14
encos heritage begin provide computerbase process control critical industrial application build expertise automation technology indepth understanding challenge face television radio broadcaster focus apply computerbase automation broadcasting enco adopt concept computercontrolle automation find hightech factory apply broadcast studio encos digital audio delivery system dad replace errorprone manual cart system commonly sequence play audio content dad increase flexibility productivity broadcaster enable troublefree automate format run hour day intervention,LinkedIn - Reported,0,2023-10-31 02:51:17,104,2023,10,31,1,0,2
leader bring expertise robotic manufacturing solution automate control system advanced automation engineering,website,0,2024-10-17 14:06:34,15,2024,10,17,3,0,14
resolution life global life insurance group focus acquisition management portfolio inforce life insurance policy,LinkedIn - Reported,0,2023-08-05 18:29:09,21,2023,8,5,5,1,18
sunman engineering specialize translate concept design product development prototype design production,website,0,2024-10-24 13:48:27,14,2024,10,24,3,0,13
nicollin group offer local authority private company optimal value service enable client improve global waste management urban sanitation industrial cleaning process return public private client nicollin group key reference establish long term stability company balance management model shareholder control family governance position enable development long term loyalty relationship proximity client consolidation margin contribute employee prosperity prosperity economic social community nicollin group participate companys core value integrity dedication success respect undertaking drive force individual motivation underpin fundamental bond nicollin family companys interest employee client,LinkedIn - Reported,0,2023-08-05 06:59:44,141,2023,8,5,5,1,6
scg partnersbuilding value strong partnershipsscg partner focus build longterm value business service arena partner strong leadership team execute smart business strategy leverage bestinclass operate resource maximize efficiency deploy sophisticated capital accelerate growthour differentiate approachscg build foundation trust,website,0,2024-02-23 02:51:42,55,2024,2,23,4,0,2
explore tcpwave aipowere ddi adc solution superior network control security seamless cloud integration redefine industry standard,website,0,2024-03-22 05:49:27,19,2024,3,22,4,0,5
engage client customer prospect take multipronge strategic approach nextpage total marketing solution company combine traditional print expertise personalize digital marketing technique drive result nextpage specialize businessbuilde idea solution utilize unmatched experience direct mail automation print commercial printing digital printing datum marketing digital marketing studio marketing portal datum model predictive analytic kitte fulfillment integrate marketing promotional product onetoone experience lead company turn custom printing marketing solution create businessbuilde solution nextpage industry experience advertising agency financial service bank credit union healthcare hospital hipaa compliant insurance nonprofit day create exceptional experience reinvent customer engage customer customer key point common maintain extensive datum customer require critical communication touch customer need flawless execution creator smart efficient onetoone brandtohuman connection exist create right businessbuilding strategy partnership client strategic marketing plan innovative efficient affordable solution positive result drive accountability result good work extension team serve customer good seat table relentless focus performance positive result customer motivate provide smart effective idea solution visit website httpsgonextpagecom contact information company page,LinkedIn - Reported,0,2023-10-30 16:04:29,309,2023,10,30,0,0,16
ve create open sociable environment combine solitude meet room concentration booth locate amsterdam,website,0,2023-07-07 15:29:56,20,2023,7,7,4,0,15
kindlink platform business charity connect manage corporate social responsibility fundraise volunteer donor crm measure share sustainability impact,LinkedIn - Reported,0,2023-11-01 12:27:59,26,2023,11,1,2,0,12
twotone offer sale marketing pr creative service cycling brand europe check weekly newsletter,website,0,2024-10-09 11:23:38,25,2024,10,9,2,0,11
austrian economic center politically independent research institute disseminate idea austrian school economic,website,0,2023-07-06 11:07:18,19,2023,7,6,3,0,11
britain ireland lead fashion brand family run lead founder designer paul costelloe brand offer diverse range product wide price range allow customer paul costelloe philosophy quality comfort confidence style,LinkedIn - Reported,0,2023-11-01 07:25:02,48,2023,11,1,2,0,7
navattic commit security privacy customer data precaution protocol follow ensure data stay protect,website,0,2025-01-26 03:40:27,27,2025,1,26,6,1,3
sprig rnd purposedriven humancentere organization specialize datadriven technology approach innovation root importance user involvement research allow produce sustainable outcome improve life people business understand value work collaboratively operate organizational boundary distributed team include partner researcher stakeholder goal foster crosscultural crossfunctional collaboration support learn enable reach shared objective sprig rnd commit create positive impact work believe focus usercentered design research allow achieve dedicate continuous improvement strive grow capacity collaboration partnership,LinkedIn - Reported,0,2023-08-06 11:42:53,131,2023,8,6,6,1,11
takagi serve vision global ophthalmology community instrument design precisionengineere care pride nagano japan believe protect people sight give ability appreciate beautiful thing great joy make instrument aesthetic functional addition worldclass technology provide quality reliability excellent service grow family distributor customer demand s takagi trust ophthalmic professional country takagi europe establish base manchester uk support distributor customer europe africa sale aftersale service comprehensive technical support training,LinkedIn - Reported,0,2023-10-30 14:00:53,130,2023,10,30,0,0,14
datum customer reach customer datadriven marketing service directly detour,website,0,2024-10-09 07:38:53,15,2024,10,9,2,0,7
terrago deliver software solution rely day lead smart city utility defense intelligence organization state country world terrago field operation application utilize global customer base include large utility exelon comed dominion energy chicago london jamaica toronto glasgow minnesota rhode island illinois comed terragos geospatial intelligence product dod army navy air force marines nga cia partner nation,LinkedIn - Reported,0,2023-12-04 17:47:52,90,2023,12,4,0,0,17
donate scrap vehicle work hundred local national charity good outcome easy car donation scheme,website,0,2024-10-10 15:03:33,28,2024,10,10,3,0,15
learn history team aquaspersion innovative manufacturing highquality aqueous dispersion emulsion,website,0,2023-07-24 11:11:40,17,2023,7,24,0,0,11
genus lead nocode software company nordic trust large enterprise create secure enterprise nocode application week change matter hour easy integration datum system let experienced industry professional improve automa,website,0,2023-07-05 09:39:01,45,2023,7,5,2,0,9
partner sciensus nhs expert patient care year experience deliver safe effective home healthcare solution,website,0,2025-03-08 05:59:04,22,2025,3,8,5,1,5
ecopol manufacturer distributor biodegradable hydrosoluble polymer build year industry experience hydrolene family customisable product serve broad spectrum industry production hub italy strong global network provide solution company worldwide continue meet grow demand new exist customer line focus customer service product quality environmental sustainability continue build knowhow proven technology add portfolio proprietary product,LinkedIn - Reported,0,2023-08-04 16:48:27,91,2023,8,4,4,0,16
industrial service provider art solve technical personnel challenge hightech company worldwide,website,0,2023-10-30 07:56:55,17,2023,10,30,0,0,7
custom software development service evrone developer year expertise agile approach quote software development solution,website,0,2023-10-31 02:16:24,26,2023,10,31,1,0,2
hey banzai product reach million user year help marketer drive revenue well event webinar content datum good marketing little human join help build future put people center marketing ready pipeline hero,LinkedIn - Reported,0,2023-12-15 16:21:53,64,2023,12,15,4,0,16
innovative integration focus help business leader grow improve organization expert infrastructure system,website,0,2023-10-26 10:56:52,22,2023,10,26,3,0,10
safenet solution level service want level service receive question found idea safenet solution llc underlying principle simple provide reliable solution technology issue timely efficient cost effective professional manner sleep,website,0,2023-10-25 08:18:30,58,2023,10,25,2,0,8
pursue integrated approach real estate,website,0,2024-09-27 01:51:39,8,2024,9,27,4,0,1
bergoz instrumentation design develop manufacture highprecision current transformer analog electronic,website,0,2023-03-31 01:25:40,15,2023,3,31,4,0,1
harmony training educational solution provider operate east africa situate mmid building rd floor westland road nairobi kenya harmony learn solution flexible design specifically company individual allow harmonize people process technology harmony use good practice help people business enhance business operation drive operational cost efficiency business growth,LinkedIn - Reported,0,2023-10-30 13:27:55,74,2023,10,30,0,0,13
copymate ultimate solution effortlessly create dozen highquality longterm seo optimize article minute,website,0,2023-10-23 15:29:23,19,2023,10,23,0,0,15
field service technology consult field service get field service integration correct not easy expertise method solution,website,0,2023-10-28 21:54:11,22,2023,10,28,5,1,21
commitment quality ascs certification adherence international standard set apart pcb manufacturing,website,0,2024-10-28 07:58:22,18,2024,10,28,0,0,7
pahln world lead manufacturer high quality equipment type swimming pool company found today partner sale country world head office production uppland vsby sweden,LinkedIn - Reported,0,2023-08-05 02:26:49,50,2023,8,5,5,1,2
dedicated team veterinary professional serve client west sussex east sussex surrey hampshire find practice,website,0,2024-10-30 15:39:39,25,2024,10,30,2,0,15
global solution health pharma research solution pharma industry biotechnologie solution surgery solution hospital pharmacy solution isolation unit solution research solution atmp production,website,0,2023-10-31 09:32:32,38,2023,10,31,1,0,9
mgaa enhance sustainability effectivity authority mga member,website,0,2023-06-27 07:09:21,12,2023,6,27,1,0,7
chicagobased firm office mexico uk france turkey india china provide supply chain digital strategy transformation consulting service midsized fortune company multiple industry big picture identify solve core problem discover new opportunity implement gamechange strategy deliver sustainable result use niche experience broad knowledge solve complex problem area business client team create strategy provide expertise need implement highvelocity breakthrough solution cgn quickly deliver gamechange strategy solution sustainable competitive edge optimize supply chain streamline internal process make operation efficient improve quality product service result breakthrough transform business differentiate competition,LinkedIn - Reported,0,2023-10-31 05:08:03,152,2023,10,31,1,0,5
travel world olivia takeover lesbian lgbtq woman cruise resort riverboat adventure safe fun curate,website,0,2025-03-11 09:17:31,25,2025,3,11,1,0,9
discover fibodo powerful platform help business professional streamline booking payment staff management automate operation increase revenue deliver seamless customer experienceall place,website,0,2025-03-06 22:17:47,30,2025,3,6,3,0,22
protect transform grow global authority family office decisionmake reserve undividedly family office srl global focus vision commitment,website,0,2024-07-16 13:01:29,23,2024,7,16,1,0,13
albelli specialist photo product expert build intuitive software create start sell photo book netherlands market leader soon expand market broaden portfolio include product wall art card calendar customer centricity core drive quality creativity innovation development provide good customer experience anytime headquarter heart amsterdam right central station paris office nordic office bergen plus resnap office nijmegen ll find plant nanteuil france factory hague produce photo product market netherlands belgium germany france sweden norway uk usa canada australia albelli work hard fun forget celebrate success value innovation create high quality product deliver good customer service like international team come join lets create memorable moment,LinkedIn - Reported,0,2023-08-05 12:22:39,191,2023,8,5,5,1,12
view new website,LinkedIn - Reported,0,2023-08-06 11:19:56,5,2023,8,6,6,1,11
greene county bancorp inc bank hold company parent company bank greene county,website,0,2024-02-19 13:22:11,18,2024,2,19,0,0,13
explore septentrios highprecision gpsgns receiver antijamme antispoofe technology reliable secure positioning critical application,website,0,2024-12-07 13:26:55,17,2024,12,7,5,1,13
adhex pioneer development pressure sensitive adhesive tape inception combine expertise employee adhex offer custom adhesive solution demanding industrial leader worldwide team world france slovakia brazil spain usa china unite share value technical creativity customer focus persistence team spirit target market automotive adhex active decade tier supplier world lead car manufacturer adhex global specialist development manufacture adhesive part automotive industry ecodesign weight saving concrete contribution automotive industry journey carbon neutrality industrial traditional adhesive tape label adhex adhesive industry building ease use range application assembly technical material waterproofing insulation protection delicate surface identification authentication industrial product decoration surface etc healthcare far restrict plaster dressing adhesive widely employ medical field patient safety ease use reinforce traceability accelerate treatment chronic wound improve patient comfort painless removal adhesive user protection hospital stay surgery procedure medical device assembly fully aware current future environmental social challenge adhex aim responsible player involve mission lead supplier custom adhesive solution thank quality technology conscious practice commitment bring meaning work unite team share value,LinkedIn - Reported,0,2023-08-04 13:23:26,293,2023,8,4,4,0,13
tyntec cloud communication provider enable business communicate easy customer workforce machine tyntec build global connectivity ground develop cloud apis provide advantage cloud communication global scale building heritage tierone global sms message provider tyntec continue advance todays enterprise utilize universal service message voice phone number connect perform transaction people world imprint httpswwwtynteccomimprint information wwwtynteccom,LinkedIn - Reported,0,2023-08-05 05:32:59,90,2023,8,5,5,1,5
clarity foresight efficiency connected world,website,0,2023-10-28 03:48:43,8,2023,10,28,5,1,3
editshare make medium management workflow process smart creative storyteller,website,0,2024-11-13 06:34:31,11,2024,11,13,2,0,6
find team expert accountant sleek trust manage accounting bookkeeping,website,0,2024-02-19 00:22:26,22,2024,2,19,0,0,0
nationwide recruitment agency vast expertise range healthcare teaching profession contain trading division hcl workforce solutions medicare team crg healthcare staffing crg defence sugarman health wellbee sugarman medical mind sugarman occupational health service sugarman occupational health recruitment sugarman education cer education monarch education,LinkedIn - Reported,0,2023-11-01 18:46:21,69,2023,11,1,2,0,18
produce sugar year invest territory quality raw material certify process learn srb,website,0,2023-09-06 19:36:11,25,2023,9,6,2,0,19
swim digital marketing estuary tide digital medium meet stream traditional grassroots marketing solution agency consulting firm create unique experience connect client customer mobilize engage community,LinkedIn - Reported,0,2023-10-31 10:58:05,46,2023,10,31,1,0,10
sport spine therapy marin sstm fullservice physical therapy group dedicate care member community offer multitude service program class order provide patient exceptional care focus individualized treatment mean design program take consideration exist level function ultimate goal work hard regular activity quickly safely possible,LinkedIn - Reported,0,2023-10-30 20:23:35,88,2023,10,30,0,0,20
beehive home assist living albuquerque offer assist living dementia care memory care facility,website,0,2023-12-27 10:45:11,15,2023,12,27,2,0,10
cuxio believe cooperation mutual support want join group certify partner,website,0,2023-10-31 08:26:12,23,2023,10,31,1,0,8
minneapolis st paul mn electrician provide electrical low voltage need residential commercial multifamily,website,0,2023-10-24 06:32:34,20,2023,10,24,1,0,6
cpi technology cpi technology familyowne operate business read,website,0,2023-10-24 12:19:44,20,2023,10,24,1,0,12
entera lead sided marketplace focus connect enterprise midmarket investor seller service provider singlefamily residential market power modern datum science artificial intelligence ai enteras marketplace offer seamless solution investor access evaluate transact operate singlefamily real estate investment back lead venture capital investor goldman sachs growth bullpen capital craft venture entera focus deliver software innovation offline service solution enable investor client scale operation quickly market datadriven decision confidently maximize financial return inception entera transact single family home value billion market company headquarter new york city new york houston texas learn wwwenteraai,LinkedIn - Reported,0,2023-12-04 14:21:52,140,2023,12,4,0,0,14
darabase unique platform enable creation management monetisation locationbase digital content real world virtual metaverse,website,0,2023-10-30 19:09:23,22,2023,10,30,0,0,19
mark th anniversary lederplast approach rebranding development new drupal website find project,website,0,2024-11-04 11:04:27,23,2024,11,4,0,0,11
ve apply digital expertise benefit local national multinational company read digital agency,website,0,2023-07-05 05:31:43,23,2023,7,5,2,0,5
change way world work end animal cruelty suffer forever join help end animal cruelty world,website,0,2024-10-05 12:45:21,29,2024,10,5,5,1,12
cto blog nis drive business continuity service adoption new standard resilience fly home backupasaservice storageasaservice insight automation security compliance cto blog usbackup job annually,website,0,2025-03-07 13:50:23,39,2025,3,7,4,0,13
expert digitally modulate screen dm prepress solution printing industry portfolio include bellissima dms flexographic printing auraia dm offset lithographic printing,website,0,2023-07-05 19:48:30,29,2023,7,5,2,0,19
rill make easy create consume metric combine sqlbase data modeler realtime database metric dashboard single productthe fast path data lake dashboard try rill free today curl s httpscdnrilldatacominstallsh bash rill start myrillproject,LinkedIn - Reported,0,2023-12-04 19:19:59,45,2023,12,4,0,0,19
jospak oy establish growth company design manufacture patent boardbase tray technology require manufacture jospak tray combine good feature cardboard plastic offering food industry environmentally friendly solution use material efficiently jospak tray reduce need plastic generate time carbon dioxide emission compare similar hard plastic packaging suitable exist production line food industry packaging solution win internationally value scanstar worldstar award jospak oy grant international brc fsc coc certificate,LinkedIn - Reported,0,2023-08-05 00:10:07,107,2023,8,5,5,1,0
wheatley home south scotland second large social landlord affordable home dumfrie galloway,website,0,2024-12-13 22:44:07,19,2024,12,13,4,0,22
find location benefit international reach local expertise logistic management,website,0,2024-12-09 09:23:43,17,2024,12,9,0,0,9
nand flash memory controller industrial grade nand flash base storage system hyperstone design develop highly reliable industrially robust ssd controller usb controller controller cf pata sd base application,website,0,2023-10-23 16:46:25,36,2023,10,23,0,0,16
go change people play improve watch tennis check website info wwwmojjofr facebook twitter regular news update facebookcomtennismojjo twittercomtennismojjo,LinkedIn - Reported,0,2023-08-06 02:11:07,35,2023,8,6,6,1,2
technology furniture hettich world large manufacturer furniture fitting country work objective develop intelligent technology furniture hettich home kirchlengern germany idea bear furniture fitting shape today tomorrow hettich brand synonymous quality innovation reliability closeness customer world technology furniture s passion excite people globe hettich mean strong partnership furniture white good industry specialist retailer trade doityourself sector,LinkedIn - Reported,0,2023-08-04 23:20:33,110,2023,8,4,4,0,23
sacramento drilling inc found currently west coast leader shoring drill shaft foundation drill solar division premier partner predrille solar pile installation united states equipment staff meet challenge expectation track mount truck mount rig hillside low overhead drilling micropile rock drilling auger cast pile core tower footing elevator shafts landfill gas well utility scale solar foundation,LinkedIn - Reported,0,2023-10-30 17:04:43,81,2023,10,30,0,0,17
expert information management datum analytic circyl building business focus trust application dna team range industry year expert information management datum analytic work late microsoft technology focusse deliver successful outcome increase business value customer solution deliver help customer find manipulate analyse share valuable information organisation deliver accurate view performance productivity whilst helping identify pinch point cause pain action drive well business outcome ensure solution provide intuitive adopt align business process key success project deliver office birmingham business park london wellequippe deliver nationwide service industry knowledge experience help business technology hire exciting role dynamic power platform bi touch,LinkedIn - Reported,0,2023-10-31 23:01:31,188,2023,10,31,1,0,23
juzo passionate develop medical aid accompany patient therapy start finish,website,0,2023-04-04 17:01:46,19,2023,4,4,1,0,17
wedding easy way find local wedding venue cake dress invitation weddingwire stress free hassle free plain free,website,0,2023-10-23 13:49:08,25,2023,10,23,0,0,13
base copenhagen polaris lead nordic private equity company invest company midmarket foundation billion euro raise different fund polaris extensive experience broad range dealtype industry nordic midmarket service production local global physical intangible offline online base nordic region company international reach focus midmarket polaris consistently focus invest midmarket company typically mean turnover m objective grow company great potential objective invest good company great potential big well partnership management board ambition double size business make operational strategic financial stepchange portfolio company,LinkedIn - Reported,0,2024-01-15 13:36:10,161,2024,1,15,0,0,13
pjm market monitoring unit responsible promote robust competitive nondiscriminatory electric power market pjm implement pjm market monitoring plan pjm market monitoring plan pjm market monitoring unit responsible monitor compliance rule standard procedure practice pjm market observe comment actual potential design flaw market rule standard procedure identify structural problem pjm market inhibit robust competitive market monitor potential market participant exercise undue market power behavior market participant consistent attempt exercise market power market performance result interaction market structure participant behavior monitor action pjm impact action market outcome,LinkedIn - Reported,0,2023-10-31 12:47:22,142,2023,10,31,1,0,12
