company_description,source,is_edited,created_at,text_lenght,year,month,day,day_of_week,is_weekend,hour
hardwood sawmill dry kiln facility location central pennsylvania honesty integrity hard work deliver quality product customer provide stable longterm reliable condition supplier employee,LinkedIn - Reported,0,2023-10-30 22:56:35,41,2023,10,30,0,0,22
workforce junction specialty boutique technology partner deliver custom solution partner modern benefit advisor ensure people manage work small midsize business smiddle market enjoy benefit advantage available big business empower employer leverage technology implementation business strategy realization desire outcome year smiddle market business owner workforce benefit advisor serve promise technology deliver benefit advantage enjoy big business aside rare exception promise go unfulfilled find techonly trap resourcelimite smiddle market space relationshipfirst approach need workforce junction hanna global deliver promise benefit junction system deliver unique combination wisdom technology service,LinkedIn - Reported,0,2023-12-04 17:15:14,163,2023,12,4,0,0,17
natural cycle birth control effective typical use effective perfect use learn hormonefree birth control today,website,0,2023-07-18 13:00:52,23,2023,7,18,1,0,13
staach multidisciplinary design manufacture company dedicate responsible business sustainable manufacturing work focus design manufacture practical object embrace simple readily available material interior space unfold robust concept,website,0,2023-10-26 04:08:05,39,2023,10,26,3,0,4
trust end end property compliance partner assess need recommend deliver solution resolve manage review risk build environment,website,0,2023-06-27 07:42:22,28,2023,6,27,1,0,7
great ecommerce strategy satisfy need consumer one currently reach company fall short meet consumer increase demand price delivery assortment,website,0,2023-10-26 06:29:16,33,2023,10,26,3,0,6
flexible employee benefit platform unique wellbee experience product service employee benefit scheme,website,0,2025-01-16 18:08:15,20,2025,1,16,3,0,18
learn founder pauline nakio pledge provide customer product feature unfettered detail impeccable fit timeless styling,website,0,2023-10-27 12:37:37,23,2023,10,27,4,0,12
spiral venture venture capital firm operate asia japan,website,0,2024-01-15 20:10:49,15,2024,1,15,0,0,20
norse firesn ew o nset r efractory s tatus e pilepticus andf ebrile nfection r elated e pilepsy s yndrome norse clinical presentation specific diagnosis healthy people suddenly strike prolonged seizure respond antiseizur,website,0,2023-10-24 22:51:29,50,2023,10,24,1,0,22
wharton business consulting enable client accelerate business value people experience deliver last transformation wide range industry company operate core client people strategy cover range programme conduct culture organisational design cloud implementation wharton business consulting independent management consultancy operate network associate collaborative approach provide client team experienced highcalibre business consultant wharton business consulting found lead natalie wharton organisational change specialist year industry experience natalie extensive change programme management expertise specific focus behavioural change talent leadership development capability development stakeholder engagement organisation design prior establish wharton business consult natalie director deloitte uk digital change lead uk culture change lead financial service,LinkedIn - Reported,0,2023-11-01 11:01:22,158,2023,11,1,2,0,11
discover kaumer ultimate solution food health business look boost customer retention leverage aipowered platform personalized notification whatsapp join transform customer interaction,website,0,2025-02-06 02:57:21,31,2025,2,6,3,0,2
vascupedia unique elearning platform vascular medicine free international combine product information animation edit live case interview expert record live event,website,0,2023-10-30 06:50:36,34,2023,10,30,0,0,6
virtual second opinion cleveland clinic patient access worldclass specialist learn virtual second opinion help,website,0,2023-10-24 22:11:14,22,2023,10,24,1,0,22
uks well trust event booking platform live breathe experience passionate make memory,website,0,2024-10-02 13:59:54,26,2024,10,2,2,0,13
addmaster polygiene group global leader supply innovative chemical additive plastic paper textile paint coating industry,website,0,2024-04-16 05:41:27,25,2024,4,16,1,0,5
wdad communication highly experienced talent communication employer branding attraction agency year help organisation sector identify target engage potential employee client large small range specialist charity nhs corporate multinational help define communicate employer brand design attraction toolkit build career site produce recruitment video manage recruitment advertising campaign advise social medium strategy provide experienced project management support ll find short difficult job find hire retain good possible talent little bit easy,LinkedIn - Reported,0,2023-11-01 13:44:11,120,2023,11,1,2,0,13
ready well ponderosa agency well uncover well insight inspire well idea deliver well result stop ve want create market leader scratch big brand big rep engage customer good return well work matter brief approach deliver well,LinkedIn - Reported,0,2023-10-30 12:56:18,77,2023,10,30,0,0,12
onfido simplifie identity verification power open secure inclusive relationship business customer,website,0,2023-06-24 22:31:13,17,2023,6,24,5,1,22
evolution combine upgrade traditional recruitment service new cutting edge solution,website,0,2023-07-24 19:17:37,15,2023,7,24,0,0,19
software house originally found berlin operate globally specialize solve complex technical challenge strategically support customer long run,website,0,2023-11-18 06:25:52,26,2023,11,18,5,1,6
shop manicure supply design precision durability nail file buffer need flawless salonquality nail home,website,0,2025-03-10 02:34:14,22,2025,3,10,0,0,2
forsa energy uk base company form develop construct operate flexible gas generation energy storage asset genesis stretch start life renewable developer forsa energy history develop operate power generation previous velocita team develop build finance sizeable renewable portfolio divest french renewable platform uk operational inconstruction asset institutional investor business rebrande enter flexible gas generation market meet uks strategic need flexibility power generation company private equity group tiger infrastructure partner network resource portfolio tiger bn management currently portfolio company,LinkedIn - Reported,0,2023-08-04 17:51:17,134,2023,8,4,4,0,17
indigo offer warehouse management system wms software uk globally provide wms software premise cloud variety industry,website,0,2023-08-20 05:35:27,27,2023,8,20,6,1,5
establish abg install operate nationally uk include northern ireland employ experienced office base team wide range capability dedicated team installer company unique position provide professional solution wide range installation requirement work closely experienced highly qualified technical team abg install provide fully insure design specification service assist gain appropriate planning consent include fully familiar breeam current environmental legislation abg install develop expertise install range environmentally sound product drainage retain wall green blue roof reinforcement water attenuation system provide reliable service company grow accommodate increase workload good management structure skilled craftsman ssst qualified wide range expertise hard soft landscaping element able undertake aspect give contract company cscs membership status staff qualified hold relevant skill card accredit citb construction skill requirement abg install fully register member bali lead trade association nation landscape professional member fully vet approve bali register bali member accreditation internationally recognise mark professionalism bali member sign strict code conduct include agreement use appropriately train staff responsible action staff sub contractor maintain high standard business professional expertise time continually raise standard excellency,LinkedIn - Reported,0,2023-11-01 11:03:15,297,2023,11,1,2,0,11
cognitive corporate finance cuttingedge technologyenhance big datapowere corporate finance firm provide new innovative financial service global scale cognitive corporate finance aim holistic connected effective corporate finance advisor world field private equitylike transaction ii secondary fund fund iii litigation funding iv complex real estate transaction proprietary investor network aim intimately aware need institutional corporate investor worldwide match real time wellexpresse capital need relevant source capital likely complete transaction want bring client relevant financial advice optimal financial solution good fast service find capital corporate requirement,LinkedIn - Reported,0,2023-08-05 18:17:35,144,2023,8,5,5,1,18
learn history august winter son,website,0,2024-01-24 19:56:25,10,2024,1,24,2,0,19
explore datum strategy stack bi tool implementation analytic expertise tasman analytic deliver actionable insight scalable solution hand team,website,0,2025-01-11 22:07:56,26,2025,1,11,5,1,22
granola bake snack goodness start fresh simple ingredient wholesome healthy granola delicious nutritious standalone snack proudly produce array gourmet granola easily create new recipe customize exist recipe add favorite ingredient crunchy,website,0,2023-10-27 12:47:20,55,2023,10,27,4,0,12
team comprise creative season executive finance operational background career corporate business real estate investing merger acquisition understand day day challenge entrepreneur business owner executive face work family capital,website,0,2024-02-23 02:42:50,56,2024,2,23,4,0,2
company serve packaging market thirty year specialise thermoforme solution wide range application light packaging technical article industry focus meet specific customer expectation support customer step step manufacture bespoke article start deep analysis possible solution aim design manufacture suitable equipment process implementation involve product development industrialisation subsidiary element product fit automation process packaging display provide integrate packaging system transit tray pallet automation line currently provide wide range market automotive industrial automation cosmetic mechanical pharma electronic food,LinkedIn - Reported,0,2023-11-01 18:51:23,118,2023,11,1,2,0,18
forte healthcare ltd establish initially distribute product widely recognise respected product treatment osteoarthritis dog cartrophen vet forte healthcare ltd producer distributor number niche novel innovative animal healthcare product well know brand generic portfolio include number market lead product cover companion performance intensive production animal portfolio grow substantially include number market lead product invest heavily regulatory affair technical support offer partner company use expertise area assistance develop new export market register product global presence export country europe asia middle east forte healthcare operate sale team ireland uk poland add country partnership joint venture subsidiary pleased recently bring exciting range new product market brand plan continuous addition range portfolio brand share vision innovation animal healthcare,LinkedIn - Reported,0,2024-10-30 10:51:17,224,2024,10,30,2,0,10
rettifica meccanica offer complete service consultancy optimization manufacture component oil gas valve inhouse mechanical workshop,website,0,2023-10-30 13:52:51,22,2023,10,30,0,0,13
airhouse nextgeneration fulfillment platform simplifie ecommerce operation logistic highgrowth brand operate manage network highperformance warehouse shipping carrier provide dtc brand good operation technology service learn airhouseio,LinkedIn - Reported,0,2023-12-04 21:21:34,44,2023,12,4,0,0,21
simnsa take realistic look healthcare need differ border cross simnsa large private health care delivery system baja california participate physician cover specialty medicine,website,0,2023-10-25 20:56:33,42,2023,10,25,2,0,20
look imprint page read ownership authorship business,website,0,2023-09-18 13:13:18,17,2023,9,18,0,0,13
skaleet saas core banking platform empower financial institution potential change continuously platform provide technological capability launch new innovative financial service delight exceed client expectation skaleet manage technology financial institution focus matter build cuttingedge offer craft proximity client skaleet evolutive apifirst core banking platform allow financial institution connect large ecosystem product technological regulatory partner resilient meet high security standard power regulate financial institution manage million account worldwide technological architecture inherent performance grant financial player well datum harness gain speed agility manage daytoday operation launch new offering minute skaleet grow employee boulognebillancourt near paris france raise m socit gnrale long arc capital,LinkedIn - Reported,0,2023-08-05 04:13:05,149,2023,8,5,5,1,4
scorpionexo scorpionexo simply wave motorcycle helmet protective gear design manufacturing scorpionexo,website,0,2024-10-21 02:36:01,22,2024,10,21,0,0,2
qr code pay table solution restaurant accept apple pay google pay direct pos integration ncr aloha toast micro simphony lavu,website,0,2025-01-07 21:05:43,25,2025,1,7,1,0,21
custom building product tile stone floor cover installation fast easy durable possible performancedriven installation system support know reliable customer service expert technical support custom building product expert customer support team website resource ensure select right tile installation material job,website,0,2023-10-23 16:19:42,60,2023,10,23,0,0,16
establish clearmark solution mission industry leader digital coding labelling solution supply,website,0,2023-10-30 23:45:55,22,2023,10,30,0,0,23
think company use research design build usercentered digital experience learn client choose think company uxui design development,website,0,2023-10-25 00:22:15,22,2023,10,25,2,0,0
lead temporary work specialist forefront industry deliver perfect solution construction engineering project learn,website,0,2023-06-30 18:00:00,23,2023,6,30,4,0,18
veritax large pure play national verification specialist sharply focus verification service contact today find,website,0,2023-12-04 20:15:54,23,2023,12,4,0,0,20
duchenne uk ambitious highly focused charity clear vision fund accelerate effective treatment duchenne muscular dystrophy dmd duchenne muscular dystrophy devastating muscle waste disease common genetic killer child worldwide uk people affect worldwide usually diagnose age mainly affect boy child dmd gradually lose muscle strength mobility limited lifeexpectancy thank recent breakthrough believe save advance accelerate medical research support family affect disease ensure receive good possible care,LinkedIn - Reported,0,2023-10-30 14:03:30,124,2023,10,30,0,0,14
inception tapqa goto quality partner dozen company nationwide include good beloved brand country,website,0,2023-12-05 09:19:54,29,2023,12,5,1,0,9
sayso medical digital medical communication agency connect healthcare professional hcp worldwide late research information debate extensive experience pharma multichannel marketing medical affair clinical research digital health production deliver highly impactful engaging virtual hybrid event content easily accessible ondemand video library connect life sciences industry university hospital healthcare professional well health capability span internationally interactive conference webcast advisory board clinical trial investigator meeting small scientific medical discussion group event pride high production quality maximise hcp reach engagement embed specialist production manager client team bespoke digital platform provide endtoend service include scientific insight advisory provide actionable insight scientific content curation digital capability,LinkedIn - Reported,0,2023-10-31 22:53:05,150,2023,10,31,1,0,22
provide growth capital exceptional team total commitment collaborative successful relationship,website,0,2023-06-24 23:18:13,16,2023,6,24,5,1,23
discover goodman masson recruitment agency specialise finance technology specialist market connect expert recruiter find ideal job talent,website,0,2024-09-29 07:17:29,26,2024,9,29,6,1,7
rotek gmbh co kg lead manufacturer small motor synchronous technology range watt,website,0,2023-10-30 06:15:42,23,2023,10,30,0,0,6
relyco specialty paper supplier provide product like synthetic paper temporary license plate business check business need,website,0,2024-10-20 13:13:27,23,2024,10,20,6,1,13
edward alexander group portfolio home design company devote ensure british craft thrive home internationally,website,0,2023-04-03 17:22:12,22,2023,4,3,0,0,17
digital marketing agency essex expert solution sme drive growth tailor strategy book discovery today,website,0,2024-02-13 21:48:27,21,2024,2,13,1,0,21
ascend analytic support hub access product documentation submit support request touch support team,website,0,2023-10-27 08:06:15,18,2023,10,27,4,0,8
true datum not buzzwordit north star,website,0,2024-11-14 02:58:12,10,2024,11,14,3,0,2
decade ramaker associate provide variety architecture engineering service client enable create successful project found town sauk city wisconsin civil environmental engineering firm strong midwest work ethic close proximity thriving city madison firm see tremendous growth recent year staff triple provide diverse line engineering service perform work location nation creation ramaker associate employee stock ownership plan esop employee empower control future continued success firm employee dedicate provide good experience client strive aboveandbeyond expect professional service provide inhouse staff architecture master planning facility condition assessment feasibility study construction administration aquatic engineering building design inspection service cemetery software civil engineering site development service environmental engineering geotechnical engineering geographic information system land surveying mep mechanical electrical plumbing design property condition assessment structural engineering technology service telecommunication consulting deployment service employee stock ownership plan esop firm employee dedicate provide good experience client strive aboveandbeyond expect current workforce experienced architectural engineering staff ramaker associate position client satisfaction new level,LinkedIn - Reported,0,2023-12-04 20:30:26,267,2023,12,4,0,0,20
opencage gmbh company opencage geocoding api company detail support open datum open source geo innovation,website,0,2023-07-04 11:24:13,26,2023,7,4,1,0,11
history ems distinguished history current owner thirdgeneration journeyman te john huizinga grandfather john huizinga run successful mechanical cont,website,0,2024-10-21 06:33:07,29,2024,10,21,0,0,6
online home assured group limit privately own vehicle logistic preparation business cover uk ireland europe,website,0,2025-02-13 09:56:51,22,2025,2,13,3,0,9
htc global service provide business process service solution help business digital change happen here,website,0,2023-03-31 10:30:00,20,2023,3,31,4,0,10
greenbrier technologies electric service technology solution provider specialize manage service backup disaster recovery network security smart home automation control system cloud solution electrical communication surveillance,LinkedIn - Reported,0,2023-10-31 15:36:39,34,2023,10,31,1,0,15
trust product service embed security,website,0,2023-04-05 11:40:08,7,2023,4,5,2,0,11
relevant content bbfintegratedsolutionscom,website,0,2024-02-07 18:15:33,5,2024,2,7,2,0,18
explore bizdata aienable datum integration ipaas analytic solution discover advanced workflow ai technology optimize business operation industry,website,0,2024-11-14 07:09:23,23,2024,11,14,3,0,7
capvidia provide true mbd workflow d cad translation validation mbd cad semantic pmi human machinereadable downstream use,website,0,2023-07-04 21:40:56,23,2023,7,4,1,0,21
decade ago fastlane story begin ideology forefront prestige vehicle body repair particular focus provide exceptional customer experience simply main aim good journey begin staff member take repair job engaged workshop strong foundation lay business start make industry catch attention manufacturing giant year trading eventually go manufacturer approve repairer prestigious brand fundamental belief principle business enable expand london fine body shop,LinkedIn - Reported,0,2023-08-06 00:22:31,130,2023,8,6,6,1,0
cunningham recreation specialize complete park playground solution design construction complete thousand installation,website,0,2023-10-25 07:56:57,19,2023,10,25,2,0,7
trippingcom lead search engine vacation rental million unique accommodation worldwide search rental site like homeaway bookingcom,website,0,2023-10-23 17:55:05,26,2023,10,23,0,0,17
rocketeffect software design website development online marketing agency saas marketing automation platform offer design development service help family entertainment industry client globe develop big brand brand recognition take knowledge leverage year worth web design development marketing experience deliver solution work focus businesss success,LinkedIn - Reported,0,2023-10-31 05:10:49,70,2023,10,31,1,0,5
financing available plumbing heat cool need,website,0,2024-01-24 22:21:30,10,2024,1,24,2,0,22
quality contax inc found base houston texas specialize recruit emerge industry leader use technology gain advantage marketplace position help company provide innovative economically sound resource solution consistently satisfy virtually requirement utilize prove networking relationship management technique provide superior technical professional need datum management project ensure continue preferred supplier fortune company provide resource complete exist project team contract contract hire direct hire bring experienced consultant custom engineer design tailor specification contract directly technical expertise development web cloud digital datum trasformation architecture design upgrade migration datum integration datum warehouse datum exchange datum storage business intelligence collaboration commitment provide right people right skill right time make project run smooth recruit resource project phase business functional requirement architecture design datum model business intelligence collaboration cloud development datum integration qa implementation enhancement support company commit recruiting team individual customer hire fulltime work short time period complete project,LinkedIn - Reported,0,2023-10-31 07:11:59,243,2023,10,31,1,0,7
funeral streaming recording busy funeral director reliable fully support north americas lead professional funeral streaming solution,website,0,2023-10-27 13:47:23,19,2023,10,27,4,0,13
develop transformative medicine neurological disorder deploy ai uncover promising molecule natural source,website,0,2023-10-29 23:27:55,15,2023,10,29,6,1,23
delicious pr birmingham lead pr event agency specialise citys leisure hospitality sector agency drive deep understanding consumer taste customer habit shape popular culture modern trend influence buy behaviour pride develop strong relationship key journalist digital influencer client bring strong round marketing knowhow couple cando attitude create run deliver great pr campaign relish challenge put great event control project creative inception final result extensive contact journalist broadcaster celebrity agent pr agency regionally nationally ability tenacity telephone journalist day plus love network journalist connect stakeholder put strong influential position come get coverage client love love achieve goal see client delight,LinkedIn - Reported,0,2023-08-06 10:39:36,185,2023,8,6,6,1,10
bcf group provide training course topic business coaching mentor management training course interpersonal skill health safety training plus,website,0,2023-10-30 19:16:55,26,2023,10,30,0,0,19
comprehensive solution large company mediumsized enterprise lead service provider germany decade service portfolio specially tailor office industrial cover area relate requirement customer staff area coverage germany austria provide onsite service flexible personalised service company headquarter warngau near munich operate branch strategically define warehouse stage location employee currently support workstation customer location germany austria,LinkedIn - Reported,0,2023-08-05 21:37:51,114,2023,8,5,5,1,21
indoor outdoor kitchen company base los angeles specialize stainless steel cook core product range range hood pizza oven grill nxr duro establish president saban chang start nexgrill large grill company today o,website,0,2023-10-25 19:04:44,54,2023,10,25,2,0,19
ink paper printer inc provide salt lake city area high quality offset digital print attention detail value add customer service set apart competition not hesitate contact project work happily provide option produce high quality work efficient cost effective manner,LinkedIn - Reported,0,2023-10-30 16:30:41,66,2023,10,30,0,0,16
browse tavano team extensive portfolio client find success netsuite ecommerce ecosystem check gygi,website,0,2023-10-24 14:47:12,19,2023,10,24,1,0,14
club metro usa fitness center new jersey great amenity great price start pursue fitness goal today sign free threeday trial pass,website,0,2023-10-27 15:32:08,30,2023,10,27,4,0,15
