company_description,source,is_edited,created_at,text_lenght,year,month,day,day_of_week,is_weekend,hour
cegid lead provider cloud business management solution finance treasury tax erp human resource payroll talent management cpa retail entrepreneurial sector solid cloud business model cegid provide long term commitment customer superior distinctive experience help company size accelerate digital business transformation locally worldwide cegid combine forward look pragmatic approach business strong capacity innovate indepth expertise new technology unique understanding regulation compliance todays rapidly change world cegid make possible help customer unleash potential thank innovative purposeful business solution bolster strong international ambition reach cegid employee sell solution country cegid report annual revenue million december pascal houillon ceo march information wwwcegidcom httpjobscegidcom,LinkedIn - Reported,0,2023-08-05 12:22:59,156,2023,8,5,5,1,12
page printer service orient printing company locate slayton mn service customer mile radius provide high quality nonheatset web sheetfe printing minimal turn time appreciate opportunity work,LinkedIn - Reported,0,2023-10-31 02:53:58,46,2023,10,31,1,0,2
unifrog wholeschool career destination platform school globe platform bring englishtaught undergraduate programme uk europe asia australasia middle east faculty canada college allow student compare apprenticeship school leaver programme education course uk mooc worldwide ve decide pathway unifrog make easy student record activity competency create send application teacher counselor unifrog streamline entire progression process allow track manage student progress place process write reference letter recommendation simplify oversight student application list breakdown requirement live status application step way free demonstration wwwunifrogorg email,LinkedIn - Reported,0,2023-11-01 12:34:34,167,2023,11,1,2,0,12
niche engineering concept supply found beagle technology group design manufacture metallic composite part structure highly finish component aerospace defence marine market period beagle involve development support major programme market sector invest heavily enable technology business companys expertise lie creation value add niche engineering concept supply sq ft principal manufacturing facility locate christchurch dorset uk metallic composite design capability offer inhouse give turnkey engineering capability customer combine highly skilled flexible responsive workforce quality control timescale price guarantee responsiveness concept supply reflect highly organise process drive business support company approve iso rev c support nadcap accreditation alongside approval large number major oem register england wales number register vat number gb,LinkedIn - Reported,0,2023-08-04 14:30:31,185,2023,8,4,4,0,14
control datum collect money exploration group increase value music copyright worldclass administration start today,website,0,2023-10-23 18:55:50,21,2023,10,23,0,0,18
clanmil register housing association profitforpurpose organisation purpose provide home people live passionate great home people live absolutely believe comfortable safe affordable home vibrant community love live thrive,LinkedIn - Reported,0,2023-08-04 15:36:41,59,2023,8,4,4,0,15
chief human resource officer chro enable business growth align human capital strategy business strategy create employee experience promote employee engagement performance chro hr function continue impressive stride ensure hr priority directly support business strategy research suggest vast opportunity position hr strategic partner value driver chro human capital talent management business prioritiesnearly hrs time spend administrative operational activity diminish capacity focus strategic talent prioritiesa leadership organizational performance partner nearly year hr talent advisory expert help chro optimize hr function ensure focus deliver value business goal help identify focus build capacity capability need achieve organizational effectiveness efficiency performance,website,0,2024-12-15 00:56:05,162,2024,12,15,6,1,0
partech global tech investment firm headquarter paris office berlin dakar dubai nairobi san francisco team independent thinker unconstraine hype trend fix way work believe power alliance action work sidebyside founder share pursuit success bring capital operational experience strategic support entrepreneur seed growth stage bear san francisco year ago today manage bn aum current portfolio company country continent,LinkedIn - Reported,0,2024-01-15 14:03:37,109,2024,1,15,0,0,14
click learn gtreasury partnership,website,0,2023-06-25 08:46:13,8,2023,6,25,6,1,8
mydnahealth awardwinne company provide detailed reliable intelligent dna test help improve wellbee indepth report,website,0,2023-10-19 22:17:11,19,2023,10,19,3,0,22
machine learn solution advertising,website,0,2024-11-12 09:17:36,5,2024,11,12,1,0,9
homepage different blog post stay place site navigation theme log wordpress user edit,website,0,2023-10-24 03:04:15,38,2023,10,24,1,0,3
start jscrambler solve important overlook security problem clientside web application expose leave vulnerable compromise find good solution protect app create build company fast forward security solution expand include clientside web app original code thirdparty integration organization innovate business demand provide continuous protection technologist heart understand value innovation software product develop entirely inhouse expert focus solely clientside not portfolio disparate product tool provide checklist security simply complete mature solution protect javascriptbase web app customer include fortune retailer airline bank enterprise success depend safely engage customer online interaction secure continue innovate fear damage revenue source reputation regulatory compliance,LinkedIn - Reported,0,2023-08-05 00:10:57,182,2023,8,5,5,1,0
securenet s iot platform turnkey bb saas solution provider interactive service security smart home mso health wellness energy vertical offer end user unique inapp experience partner exclusive app branding securenet enable partner increase rmr gain efficiency enhance brand awareness unique service value securenet patented architecture provide fast secure alarm transport direct integration partner central monitoring station offer dualpath cloudbase platform securenet provide great redundancy supervision enable instant response live way status security connected device securenet privately hold company headquarter florida usa location emea australia information visit securenettechcom,LinkedIn - Reported,0,2023-12-04 16:13:38,124,2023,12,4,0,0,16
apricity resource provide suite office share service skilled nursing center bed united states headquarters nashville tennessee apricity resource offer long term post acute care provider centralized support platform provide office function need support operator understand take care patient resident require focus operator s spend time make operator job easy place focus support need goal provide world class customer service support customer superior operation communication specialty include billing collection information technology account payable payroll service human resource recruit marketing financial planning analysis,LinkedIn - Reported,0,2023-10-31 01:17:46,136,2023,10,31,1,0,1
barker brettell large uk intellectual property firm attorney large team professional support staff specialise ip portfolio strategy management clearance prosecution opposition cancellation enforcement advise client world patent copyright design trade mark related matter domain name company name custom issue,LinkedIn - Reported,0,2023-08-05 19:07:06,57,2023,8,5,5,1,19
thank expertise fineblanke form electrolamination stamp directly strengthen customer competitive advantage,website,0,2023-08-16 19:42:10,17,2023,8,16,2,0,19
filmop international company specialize design production manual equipment professional cleaning environment,website,0,2023-10-28 18:34:28,19,2023,10,28,5,1,18
look great people join team,website,0,2023-07-07 08:50:33,10,2023,7,7,4,0,8
wells brothers inc source residential commercial material flow solution electronic control electrical compliance prevention hvac plumbing concrete excavation work superior customer service,website,0,2024-01-24 22:32:08,29,2024,1,24,2,0,22
treximo merge propharma propharma help company excel stage pharmaceutical lifecycle collaborate client cocreate optimal solution build sustainable scalable operating model develop auxiliary capability position client development growthand speed consistency scale true partner start finish help client solve complex challenge dynamic environment,LinkedIn - Reported,0,2023-10-31 07:54:13,68,2023,10,31,1,0,7
year bpw embody progress change transport industry pioneer new technical development innovation,website,0,2023-12-15 07:47:06,22,2023,12,15,4,0,7
cinfo technology provider focus ott tv market provide advanced cloudbase automatic tv production system couple cloud settopbox technology metadata database work cinfo create tv event robotize camera artificialintelligencebase track software system produce standard broadcast tv signal multicamera signal vod library personalize promo channel ott streaming video destination platform work tv operator broadcaster producer sport club music venue sport federation smart citieswe help distribution production create million tv event low possible cost deliver complete project venue production channel branding emission cinfo take care value chain require create new modern tv channel come visit,LinkedIn - Reported,0,2023-08-04 15:33:52,154,2023,8,4,4,0,15
discover nominet find uk domain registry rapidly grow business cyber security public benefit initiative,website,0,2023-06-26 09:26:17,28,2023,6,26,0,0,9
diverse range business help million people world live good life,website,0,2023-10-17 05:12:27,16,2023,10,17,1,0,5
tada group ab swedish medtech startup focus connect solution unmet need healthcare sector,website,0,2023-04-03 15:03:37,19,2023,4,3,0,0,15
nicholas associates group group recruitment company specialist field support talent apprentice boardroom,website,0,2023-10-30 23:33:33,21,2023,10,30,0,0,23
fantastic partner network strong find quanos partner near,website,0,2023-04-04 16:00:27,17,2023,4,4,1,0,16
work business size sector assist sale marketing team data engagement research need,website,0,2025-02-14 03:22:27,23,2025,2,14,4,0,3
big goal history future discover achieve year,website,0,2023-06-27 08:23:01,24,2023,6,27,1,0,8
webbox deliver bespoke website performance marketing campaign sport health leisure organisation help digitally fit,website,0,2024-10-12 14:35:56,19,2024,10,12,5,1,14
dgf investimento lead brazilian venture capital investor currently invest seventh fund focus early stage saas startup historically dgf team complete investment successful exit,LinkedIn - Reported,0,2024-01-15 13:53:34,41,2024,1,15,0,0,13
crockett jones maker fine english men womens handmade shoe footwear found northampton specialise manufacture high quality goodyearwelte handmade leather shoe,website,0,2023-04-04 16:20:41,32,2023,4,4,1,0,16
partner advance human health provide range contract pharmaceutical development manufacturing service globally,website,0,2024-09-30 02:46:25,16,2024,9,30,0,0,2
access comprehensive esg datum tool benchmark rating assess supplier manage risk company source informed decisionmaking,website,0,2025-01-26 22:59:22,21,2025,1,26,6,1,22
global id provide well approach enterprise datum management data specific solution include datum lineage datum governance metadata management datum quality datum catalog,website,0,2023-10-24 20:26:44,27,2023,10,24,1,0,20
nordic data resource ndr help agency advertiser respectfully build reach unique audience nordic collect private consumer datum datum include actual purchase datum like car ownership enable offer online audience nordics ndr provide safe reliable scalable online targeting opportunity marketing funnel relevant device channel datum accessible major dsp platform audience datum global agency group different medium agency denmark sweden norway finland data set provide fullreach online audience base ground datum programmatically provide effective use marketing funnel connect advertiser online marketing activity crm database available omnichannel activation service provide valuable opportunity identify strategic important target group optimize reach frequency attractive cpm spend surplus target build big audiencesrevenue find enthusiastic people target audience build strong interest like preference well involvement reduce actual cpc target audience include people buyer intent datum ndr partner datum focus campaign increase frequency high conversion lead action low cpa cpo identify key customer mosaic segment increase frequency grow valuable customer segment sale loyalty cpo cps,LinkedIn - Reported,0,2023-08-06 05:56:16,259,2023,8,6,6,1,5
glaze tool engineering provide automation system tool appliance agriculture automotive medical pharmaceutical consumer industry,website,0,2023-10-26 22:54:38,18,2023,10,26,3,0,22
inception worldwide court reporter earn unparalleled reputation excellence court report videography document databasing trial support cuttingedge technology utilize highprofile case country globe provide live witness video interactive realtime feed available private chat streaming,website,0,2023-11-24 11:51:05,55,2023,11,24,4,0,11
usacscast proud present podcast dedicate quality education discussion topic relevant practice emergency medicine today listen,website,0,2023-10-26 12:07:25,25,2023,10,26,3,0,12
ashby help scale company achieve ambitious growth target ashby team size run fast efficient hiring process trust company include opendoor figma notion deel modern treasury,LinkedIn - Reported,0,2023-12-04 19:20:34,34,2023,12,4,0,0,19
redkik saas company solve inefficiency logistic transportation industry embed insurance power ai,website,0,2023-12-15 22:33:54,19,2023,12,15,4,0,22
blond mcindoe research foundation fund groundbreake research burn wound healing technique technology repair restore regenerate tissue reduce debilitate scarring,website,0,2023-10-20 00:10:40,28,2023,10,20,4,0,0
george chartered financial planner fly colour learn george visit page,website,0,2023-12-20 07:30:38,18,2023,12,20,2,0,7
msp lead manufacturer spring stamping vast range exotic material year experience,website,0,2023-06-27 16:17:28,22,2023,6,27,1,0,16
omega diagnostic international diagnostic test business passionate improve life world accurately inform health decision collaborate laboratory partner organisation provide worldleade food sensitivity test country,website,0,2023-12-07 05:00:34,38,2023,12,7,3,0,5
medica uk subsidiary medica plc market leader provision teleradiology remote radiology reporting service use late technology clinical diagnostic support public private hospital reduce waiting time radiology report service include emergency radiology reporting elective radiology reporting produce million report annually provide radiology department ability manage workflow efficiently provide rapid access large team gec register specialist consultant radiologist fast reporting ensure early diagnosis improve patient experience outcome work nhs organisation highquality service delivery clinical governance make medica partner choice client worldwide flexible workplace radiology job available find click sign button,LinkedIn - Reported,0,2023-08-05 20:43:53,145,2023,8,5,5,1,20
creative collective pharma marketing specialist brand rfa treatment,website,0,2023-10-31 18:17:18,13,2023,10,31,1,0,18
team game engineering year experience turnkey design plant solution experience guarantee,website,0,2023-06-27 07:51:54,23,2023,6,27,1,0,7
wealth experience communication industry connect leadership team shape strategy operation engage client contact centre service ccaas project set tone business embody value behaviour remain committed ensure independence vendor,website,0,2024-09-27 09:40:38,53,2024,9,27,4,0,9
drivosity lastmile delivery solution provider deliver great driver deliver drivosity understand final stretch delivery critical business success vital point logistic process important customer touchpoint s build suite service far traditional solution provide add value platform focus provide visibility realtime actionable datum insight prove propel driver safety efficiency productivity tracking promote safedrive habit vital metric datum prove save life generate significant saving customer line enhanced visibility training report feature fuel manager tool need effectively coach team empower incentivize driver personal score able foster highperformance team nurture culture safety provide peace mind driver manager produce consistently positive customer experience want work join demonstration httpswwwdrivositycomrequestdemo,LinkedIn - Reported,0,2023-12-04 19:13:46,199,2023,12,4,0,0,19
culinary agent careerrelate website hospitality industry empower talent discover job help business hire good talent,website,0,2023-12-04 15:20:55,22,2023,12,4,0,0,15
access platform sale help hundred satisfied customer work safe smart height grow uks large independent supplier access platform material handling equipment,website,0,2023-11-28 15:00:12,34,2023,11,28,1,0,15
packetviper cybersecurity company provide solution converge ot network protect critical infrastructure active cyber defense,website,0,2023-12-06 09:23:29,21,2023,12,6,2,0,9
global insurtech company offer good software solution claim management fraud detection autoadjudication claim create compelling claim automation payment integrity platform global medical insurance sector current client include large enterprise globally like watania adnic care health insurance tata aig hdfc ergo recognise ai startup global delhis win insurtech nasscom emerge winner innovative insurance ai product marketsandmarket global giant like ibm sas fico etc good solution health insurance nasscom saas startup year saasboomi deep tech startup information product service request demo write,LinkedIn - Reported,0,2023-12-15 15:56:50,137,2023,12,15,4,0,15
eodev develop industrialise sustainable reliable accessible energy solution hydrogen,website,0,2023-03-31 23:07:46,12,2023,3,31,4,0,23
software advisory company specialize custom cloud solution aim create benefit stakeholder design building software solution maximise positive impact,website,0,2023-10-30 20:06:30,28,2023,10,30,0,0,20
forward motto forwardforward seek forward gobefore unknown track ultimate roada driver overtake chance cornera creator change way movingbecause future motorsport designedvehicle eueciency racing rule safety limitsthese question shape,website,0,2024-11-16 10:02:32,56,2024,11,16,5,1,10
lead hr marketing finance executive recruitment agency fee rebate protection,website,0,2023-07-06 11:01:43,16,2023,7,6,3,0,11
townsweb archive ltd work uk heritage organisation help protect physical archive provision specialist digitisation service twa digitise material type photograph register report journal magazine ledger minute large format painting drawing map roll film microfiche mm slide convert specify format find httpstownswebarchivingcom management publishing platform pastview uniquely develop provide good possible solution enhanced access discovery digital collection online open opportunity revenue generation find httppastviewtownswebarchivingcom,LinkedIn - Reported,0,2023-11-01 04:11:31,101,2023,11,1,2,0,4
learn search setting web incubator accelerator investor ethereum decentralization dao daos metaverse nft,website,0,2024-04-04 02:10:19,19,2024,4,4,3,0,2
exclusive early access member improve emotional wellbeing paradym,website,0,2023-12-06 16:35:58,13,2023,12,6,2,0,16
save time content automation datum maintenance multilingual text datum preparation automate,website,0,2025-01-17 12:39:07,21,2025,1,17,4,0,12
ryalto allinone communication employee engagement shiftbooking platform love worker,website,0,2023-10-31 21:18:30,13,2023,10,31,1,0,21
empower institution academic impression access comprehensive library online resource training faculty staff high education,website,0,2024-10-24 20:48:40,22,2024,10,24,3,0,20
proud home air conditioning heating indoor air quality need lansing mi,website,0,2024-01-24 23:27:42,21,2024,1,24,2,0,23
hi young alfred m mission turn hour nightmare shop home insurance online informed minute transaction direct insurance carrier partner platform young alfred build serve homeowner america service young alfred,LinkedIn - Reported,0,2023-12-04 21:36:48,60,2023,12,4,0,0,21
coursedog software company found student drive operational efficiency high ed innovate datum accelerate student success,website,0,2023-12-15 18:56:32,22,2023,12,15,4,0,18
found genisys consulting ltd specialise improve decisionmake smart use datum partner client design build support big datum business intelligence bi data analytic application healthcare education retail sector client include wellcome nhs great ormond street hospital child university oxfordsaid business school american institute foreign study aif,LinkedIn - Reported,0,2023-11-01 15:43:46,69,2023,11,1,2,0,15
lead global law firm aerospace commodity construction energy insurance shipping sector,website,0,2024-10-01 00:17:16,15,2024,10,1,1,0,0
preseed seed fund focus pnw bc startups,LinkedIn - Reported,0,2024-01-15 14:14:59,10,2024,1,15,0,0,14
build heritage audio solution easytointegrate voice interface provide state art sound processing compelling price perfect developer want good choice voice,website,0,2023-11-10 09:11:41,32,2023,11,10,4,0,9
explore uks premier solar solution pv slate solar slate infinity roof integrate solar gbsol power home sustainably,website,0,2024-10-30 17:20:55,21,2024,10,30,2,0,17
lead technical engineering recruitment agency find job aviation construction utility energy manufacturing technology sector today,website,0,2024-10-05 21:12:27,19,2024,10,5,5,1,21
heurtey petrochem solution world leader process furnace refining petrochemical syngas hydrogen market heurtey petrochem solution provide comprehensive offer include design manufacturing process furnace waste heat recovery unit process feasibility study service axen acquire share heurtey petrochem furnace activity service operate heurtey petrochem solution brand,LinkedIn - Reported,0,2023-10-31 19:54:47,72,2023,10,31,1,0,19
found green man cannabis colorado premiere brand marijuana strive achieve high level quality selection customer service competitive price,LinkedIn - Reported,0,2023-10-30 21:01:00,28,2023,10,30,0,0,21
meet smartimpact team trust provider technology solution membership organisation association institute regulatory body charity fundraise organisation,website,0,2023-07-04 11:12:21,21,2023,7,4,1,0,11
anand mahindras guidance leadership mahindra group lead billion dollar organization india read history success stroy,website,0,2023-04-04 18:03:49,24,2023,4,4,1,0,18
celebrate year experience service commercial printing cereus graphic hold competitive edge offer highquality reliable affordable offset digital printing service packaging solution mailing service integrate marketing solution approach strategic customize design maximum effectiveness partner company longterm success member marketing communication team look forward develop solution meet need accomplish goal help idea shape reliably consistently affordably,LinkedIn - Reported,0,2023-10-30 17:49:32,87,2023,10,30,0,0,17
create base eastern shore maryland bdk proud involve local community learn,website,0,2024-10-22 09:19:45,24,2024,10,22,1,0,9
zoe help improve health athome test personalize food score expert nutrition advice thrive zoe sciencebacke program,website,0,2025-02-07 06:59:45,21,2025,2,7,4,0,6
synechron innovative global consulting firm deliver industryleade digital solution transform empower business,website,0,2023-06-25 08:57:52,16,2023,6,25,6,1,8
unbelievable codable offer tailor solution industry include web application mobile app cloud service,website,0,2023-07-04 03:10:33,19,2023,7,4,1,0,3
year experience print finish equipment buy absolute confidence assure unbeatable sale support,website,0,2023-07-06 20:40:56,19,2023,7,6,3,0,20
thrive strategic marketing communication consultancy provide integrate resultsdriven approach deliver tangible business opportunity growth work small medium sized company startup work tirelessly understand business customer pain point journey acquisition ultimately customer retention advocacy thrive thrive extension marcom department ownermanage marketing function virtual cmo service offer insight benefit inhouse senior marketing leader fraction cost pay insight initiative need need sme startup challenger brand operate crowded market finite resource team challenge help develop marketing strategy plan take care complete integrate marketing campaign conceptualisation measurement thrive help thrive talk talk work sale team leadership determine desire outcome create integrate marketing communication strategy deliver lead leave business development team time close sale ready thrive visit wwwthrivemarcomscouk let thrive,LinkedIn - Reported,0,2023-10-31 22:21:42,214,2023,10,31,1,0,22
meet costperform software empower people solve complex cost performance question year business client country serve startup leader thank year experience global partner network unique software platform costperform leader cost performance,website,0,2024-12-24 07:35:23,55,2024,12,24,1,0,7
mentor relationship design build confidence support able control development,website,0,2023-10-31 19:41:57,22,2023,10,31,1,0,19
trust senior living facility willsboro ny provide dedicated assist live nursing service memory care elderly adirondack resident,website,0,2023-10-26 20:32:13,21,2023,10,26,3,0,20
