company_description,source,is_edited,created_at,text_lenght,year,month,day,day_of_week,is_weekend,hour
medium technology purpose name mafiacivil mafia certified minority woman own business specialize adtech digital medium business acceleration year experience digital field iso information security standard iso quality management standard certify,website,0,2023-10-24 04:11:16,56,2023,10,24,1,0,4
empower organization understand intelligently decarbonize operation hourly track emission datum,website,0,2023-12-06 22:45:47,14,2023,12,6,2,0,22
data migration international goal develop industryleade product deliver excellent service customer,website,0,2023-07-06 00:38:11,21,2023,7,6,3,0,0
support company public entity family path energy technological environmental improvement,website,0,2023-04-03 05:00:48,16,2023,4,3,0,0,5
commitment improve global public health activinsights isaccelerate pharmaceutical drug development enhance clinical practiceand improve disease management trust digital health technology digital health technology build wearable secure,website,0,2024-12-28 14:47:37,33,2024,12,28,5,1,14
liberty marketing company work local chamber commerce city county government tourism center civic group lake authority publish accurate detailed city county lake map update informative chamber guide publication help business community advantage power network,website,0,2023-10-26 03:29:08,55,2023,10,26,3,0,3
facilitate remarkable patient experience stage clinical trial journey patient support management logistic,website,0,2025-02-09 07:32:27,19,2025,2,9,6,1,7
bridge gap design creativity business strategy develop marketing communication solution unique client,website,0,2023-10-24 03:07:50,21,2023,10,24,1,0,3
ukcom britain premium domain extension help boost online presence achieve business success,website,0,2024-01-15 23:29:37,16,2024,1,15,0,0,23
fastem visionary engineering firm dedication customer ambition push future manufacturing technology,website,0,2024-01-15 04:38:39,21,2024,1,15,0,0,4
highly symbolic visit minister development mr takis theodorikakos ambassador united states greece mr george tsounis secretary general private investment mrs stellina siarapi visit morning facility onex shipyard elefsina accompany representative embassy greece associate ministry development,website,0,2024-12-18 14:28:25,59,2024,12,18,2,0,14
smartaim base netherlands smartaim global operate identity access management development company smartaim design en produce smartaim authorisation management suite smartaim trust identity access management specialist world lead business,LinkedIn - Reported,0,2023-08-06 11:15:36,44,2023,8,6,6,1,11
discover aab esg initiative sustainability goal learn environmental social governance practice impact,website,0,2024-10-06 05:14:44,18,2024,10,6,6,1,5
commitment grow smart idea fastgrowe company not happen overnight harsh truth attempt fail route success difficult navigate decision way competition fierce uminova innovation come,website,0,2023-07-04 04:36:18,55,2023,7,4,1,0,4
wwfuk world wide fund nature uk company believe good governance fundamental charitys success,website,0,2023-09-20 17:33:31,21,2023,9,20,2,0,17
world intuitive computer vision platform build user technical ability code require,website,0,2023-12-06 10:37:39,17,2023,12,6,2,0,10
understand customer well win use market research consumer insight help organization good decision grow fast competition welcome ultimate growth hack schedule consultation mindreade ability shocknawe strategy big win big future sacred cow instinct let redo experience,website,0,2023-10-25 11:54:26,55,2023,10,25,2,0,11
banca passadore c privatelyowne independent bank serve private business customer,LinkedIn - Reported,0,2023-08-04 14:24:12,16,2023,8,4,4,0,14
found sail accountancy tax advisory specialist provide world class advisory client operate multiple country help structure personal business affair good way possible today save money,LinkedIn - Reported,0,2023-08-06 10:31:11,43,2023,8,6,6,1,10
decade klaas puul bv lead producer fresh fish product europe catch delivery customer klaas puul manage entire production processing procedure thank highquality production system authentic craftsmanship offer high quality seafood crayfish continue read,website,0,2023-04-01 23:21:40,61,2023,4,1,5,1,23
view brinton history start manufacture carpet pioneer wool nylon blend celebrate queen diamond jubilee,website,0,2023-06-27 04:40:28,23,2023,6,27,1,0,4
methodica technology emerge embed technology firm offer embed solution wide range project business need vision worldwide premier total solution provider rapid control prototyping rcp embed software model base development mbd calibration support test automation hardware loop testing hil service provide automation platform base customer need hardwareinloop consulting dspace eta ni rapid control prototyping development micro autobox crio software loop testing auto code generation target link real time workshop embed software development c matlabsimulink android mission facilitate customer excel modelbase development embed software testing enable customer select good tool chain available market provide flexible test platform decrease time market embed product modelbase development rapid control prototype initial software development stage,LinkedIn - Reported,0,2023-10-31 16:29:01,158,2023,10,31,1,0,16
serruya private equity inc global private equity firm focus transform company collaborate management develop implement strategy leverage spe exist operational financial resource,LinkedIn - Reported,0,2024-01-15 14:15:45,31,2024,1,15,0,0,14
ivc evidensia lead veterinary service provider network clinic hospital approximately employee country europe core mission clinical independence international cooperation continuous education develop people career disability confident employer keen hear candidate disability long term health condition happy discuss reasonable adjustment need recruitment process,LinkedIn - Reported,0,2023-08-05 07:59:46,81,2023,8,5,5,1,7
heritage safety critical software development testing verification validation provide technology trust,website,0,2023-12-15 23:41:27,19,2023,12,15,4,0,23
excellent science ceric main aim contribute creation excellent science inhouse activity service international user achieve mainly provide open access research facility call proposal year address researcher require use complementary technique find,website,0,2023-10-27 18:56:46,58,2023,10,27,4,0,18
learn face webrecruit brand meet board member leadership team,website,0,2023-10-28 04:52:58,17,2023,10,28,5,1,4
ensemble health partner lead revenue cycle management company hospital health system physician practice,website,0,2024-11-12 08:57:53,17,2024,11,12,1,0,8
abl recruitment londonbased agency specialise multilingual sale marketing finance admin recruitment,website,0,2023-07-07 10:53:02,15,2023,7,7,4,0,10
late news information insight group operator online retailer verycouk littlewoodscom,website,0,2023-04-04 17:09:30,18,2023,4,4,1,0,17
aiw inc lead integrated manufacturer highlyengineered custommanufacture building product provider installation service specialty metal structural steel washington dc metropolitan region aiw provide product service national customer complex class building project major metropolitan market united states aiw manufacture,website,0,2023-10-25 01:17:53,55,2023,10,25,2,0,1
dranetz world leader manufacturing advanced power quality analyzer,website,0,2024-10-23 14:47:19,13,2024,10,23,2,0,14
visualvault offer capability inhouse require tie transition unified digital environment,website,0,2024-02-05 20:03:40,20,2024,2,5,0,0,20
mobileplus complete mobile asset inventory solution accurately automate asset task audit activity learn request demo today,website,0,2023-10-25 23:05:35,23,2023,10,25,2,0,23
need urgent veterinary care emergency vet service memphis provide prompt compassionate care pet contact partner,website,0,2025-01-06 13:41:02,26,2025,1,6,0,0,13
prime electric found ray moya weldon claunch dale phagan time prime pride provide customer high standard quality installation service professionalism utmost attention customer ensure receive good product possible commitment detail planning execution project primary focus growth acquisition gamblin rodger year old company march enhance ability provideservice maintenance electrical testing green project addition prime electric concern future environment instrumental establishment green project division install renewable energy source provide energy saving retrofit,LinkedIn - Reported,0,2023-10-30 21:36:37,130,2023,10,30,0,0,21
storegate swedish cloud service provider provide online file storage online backup collaboration synchronization tool cloud guarantee professional user,LinkedIn - Reported,0,2023-08-05 04:43:17,28,2023,8,5,5,1,4
foresight consult innovative solution provider help business maximize productivity profitability effective use technology specialize business intelligence software development engineering web application website design content management system database design staffing project outsource work small business large corporation,website,0,2023-10-25 15:18:05,49,2023,10,25,2,0,15
csol laboratory informatic company form dedicated passion maximize return investment improve effectiveness productivity quality laboratory type order deliver goal ve distil knowledge expertise range software product solution technology commonly todays sophisticated laboratory help product help form seamless link sophisticated instrument laboratory information system lim laboratory scientist analyst technician csol solution help remove tedium error rate associate manual transcription maximize investment instrument reagent laboratory personnel discuss requirement request demonstration product feel free contact csol contact page telephone email look forward help solve user regulatory requirement csol ltd heath runcorn cheshire wa qx uk tel web httpwwwcsolscom,LinkedIn - Reported,0,2023-11-01 11:37:44,184,2023,11,1,2,0,11
protect million dose essential medicine vaccine worldwide day partner pharmaceutical industry advance global health equity discover legacy network pharma trust partner,website,0,2024-09-26 21:53:36,34,2024,9,26,3,0,21
discover book scuba diving underwater adventure travel dive green explore blue ecofriendly resort liveaboard choose,website,0,2024-09-30 19:11:59,23,2024,9,30,0,0,19
green garden creative digital agency create territory sport lifestyle entertainment absolutely delighted thankful count client massive brand like nike adidas puma netflix warner bros th century fox disney ea sports deezer spotify expertise earn medium development influential marketing activation lifestyle influencer own pay medium development box display asset social ad client website wholesale development brand corner concept client host marketplace recreate optimal brand experience,LinkedIn - Reported,0,2023-11-01 12:21:23,105,2023,11,1,2,0,12
client challenge todays cio cto director enterprise operation need scalable secure infrastructure able,website,0,2023-10-26 19:28:45,20,2023,10,26,3,0,19
serve hvac fabrication electrical control system need,LinkedIn - Reported,0,2024-01-24 16:31:10,9,2024,1,24,2,0,16
fly circus service provider digital sovereignty open source solution combine experience diversity unique technology digital transformation cloud platform,website,0,2024-02-16 22:46:35,30,2024,2,16,4,0,22
ve provide client residential nonresidential appraisal report year serve central northeast pa,website,0,2023-10-25 03:10:14,21,2023,10,25,2,0,3
spectrum webop service scalability performance expert build worldclass application infrastructure empower business,website,0,2023-12-05 04:03:37,21,2023,12,5,1,0,4
zelt hr hr software modern company use manage hr finance workflow place,website,0,2024-11-05 18:57:12,23,2024,11,5,1,0,18
combine metal company provide roll precision strip slit coil blank meter wide wire product,website,0,2024-10-03 17:24:36,26,2024,10,3,3,0,17
heavybit help startup turn vision movement product platform contributor community company redefine team build deploy secure scale missioncritical technology jamstack devsecop feature flag heavybit founder build future software,website,0,2023-12-04 15:49:36,47,2023,12,4,0,0,15
hitech asset lead provider asset disposition service leverage technology provide range service require securely retire surplus computer hardware maximize cash recovery commit work hard customer simplify disposition process ensure dollar return entire spectrum asset hitech asset provide customer peace mind provide thorough tracking reporting system available asset verifiably track date receive final disposition remarkete responsibly recycle choose provider itad liquidation service impressive customer list fortune company major university computer leasing company,LinkedIn - Reported,0,2023-10-31 02:17:52,121,2023,10,31,1,0,2
mindqu connect talent good vacancie assist company recruit right talent solve challenge permanent talent freelance consultant,website,0,2023-10-30 05:06:34,26,2023,10,30,0,0,5
mission educate student advance technology innovate future vision advance global society develop premier thinker lifetime innovation uat ideal environment maker technophile maven digital world evolve executive master programmer cyber warrior digital entertainer forensic sleuth robotic engineer interactive filmmaker game innovator uat unique technologyinfuse campus design enhance collaborative handson learn connect student industry professor student unlimited access lab day uat oncampus lab stock current software constantly upgrade worldclass hardware guidance brilliant passionate mind dedicate support student innovation uat recognize leader innovation technology education select percent stembase university nation unrivaled computer science degree program benchmark success academia uat deem center academic excellence information assurance education caeiae department homeland security learn wwwuatedutechnologyuniversitymission,LinkedIn - Reported,0,2023-12-04 19:30:29,185,2023,12,4,0,0,19
cnx therapeutic european pharmaceutical company dedicate improve life patient supply essential medicine commercialise distribute portfolio speciality brand hospital product europe country worldwide directly strategic partnership vision recognise partner choice commercial excellence patient focus presence europe,LinkedIn - Reported,0,2023-08-05 18:40:55,66,2023,8,5,5,1,18
message director commitment customer drive desire provide quality service return well saving financially environment touch help govuk achieve net zero emission mission value csr industry message director mission value make live sustainably,website,0,2024-10-04 10:54:38,56,2024,10,4,4,0,10
accelq powerful software test tool achieve codeless test automation accelerate continuous testing,website,0,2023-10-27 15:37:21,17,2023,10,27,4,0,15
datacopia datum visualization reimagine create beautiful chart graph online instantly simply paste datum,website,0,2023-10-30 22:00:30,18,2023,10,30,0,0,22
learn hvac mechanical contracting service build vast base repeat client new york city area,website,0,2023-10-25 21:00:18,22,2023,10,25,2,0,21
support heart research charity mission protect people cardiovascular disease like heart disease atherosclerosis diabetes heart attack stroke,website,0,2023-10-19 19:29:50,21,2023,10,19,3,0,19
xpertex cyber security leader wealth experience military defence intelligence organisation speak consultant,website,0,2023-10-29 01:29:44,21,2023,10,29,6,1,1
hit jobspecific training solution employee practical skill ability need excel develop,website,0,2023-11-12 14:58:15,19,2023,11,12,6,1,14
augustine surgical inc focus make surgery safe innovative healthcare product improve cost effective outcome,website,0,2023-10-24 16:25:58,18,2023,10,24,1,0,16
monroe capital llc monroe premier boutique asset management firm specialize private credit market strategy include direct lending assetbase lending specialty finance opportunistic real estate structure credit equity firm successfully provide capital solution client canada monroe pride valueadded userfriendly partner business owner management private equity independent sponsor monroe platform offer wide variety investment product institutional high net worth investor focus generate high quality alpha return irrespective business economic cycle monroe grow team approximately employee investment professional billion committed manage capital management monroe active investor middle market invest billion transaction inception headquarter chicago monroe office atlanta boston los angeles miami naples new york san francisco seoul monroe recognize peer investor award include private debt investor low midmarket lender year clo manager year americas good performance private debt mid cap korean economic daily global ma network small midmarket lender information important disclaimer visit wwwmonroecapcom,LinkedIn - Reported,0,2023-08-05 20:23:37,241,2023,8,5,5,1,20
septentrio design manufacture highprecision oem gnss receiver surveyinggis equipment trust prominent dredging uav agricultural company septentrio product note provide consistent accurate reliable gpsgns position world remote region contact team today evaluate need advise good option demonstrate septentrios superior positioning build quality benefit team,LinkedIn - Reported,0,2023-08-05 09:30:02,76,2023,8,5,5,1,9
plural strategy strategy consultancy medium information technology industry drive growth deliver real impact client analytical problemsolve deep industry expertise customerfirst approach global outlook multilingual work take continent operate flat open inclusive structure bring good value everyone perspective want achieve excellence deliver impact curious drive find right answer seek understand client customer actively listen transparent people client treat fairly equally care share idea knowledge success,LinkedIn - Reported,0,2023-08-05 20:08:37,133,2023,8,5,5,1,20
cube infrastructure manager independent midmarket infrastructure investor join deep sector knowledge operational financial expertise foundation cube leverage operational financial capability pioneer transform essential local infrastructure asset area fiber district heating mobility ev charge firm deliver essential infrastructure asset local community authority drive significant growth portfolio cube raise aggregate billion manage fund cube infrastructure fund cube infrastructure fund ii cube infrastructure fund iii focus investment regulated brownfield infrastructure connect europe broadband fund fund dedicate greenfield investment broadband infrastructure project creation cube successfully investment europe continue invest profitable responsible investment opportunity strong growth potential,LinkedIn - Reported,0,2024-01-15 13:49:53,148,2024,1,15,0,0,13
bring product interior design architectural market having recognise tremendous purchasing influence hold interior designer architect objective product visible accessible tidb provide actionable insight form consultancy advisory service alongside digital marketing manufacturer,website,0,2023-12-18 09:04:47,56,2023,12,18,0,0,9
mwan mobile provide product software development service consult blockchain fintech mobile payment mobile digital space product include turnkey service delivery platform vas application portal enterprise blockchain enabler platform application development include ios android development service consulting deliver europe base uk cyprus middle east north africa dubai mwanmobile help vas mobileapplication blockchaindevelopment custom bespoke solution look business,LinkedIn - Reported,0,2023-11-01 04:23:35,95,2023,11,1,2,0,4
past year coronet spa produce synthetic leather manufacturing sector coronet leather create footwear clothing item leather good renowne world high quality company found enrico de marco record year success thank constant investment rd coronet innovative actor acknowledge global leader polyurethane coating sector,LinkedIn - Reported,0,2023-08-04 15:57:44,83,2023,8,4,4,0,15
betinv provide allinone sportsbook widget online casino gambling business fast reliable odd feed exclusive sport esport solution,website,0,2023-07-04 09:51:43,21,2023,7,4,1,0,9
baftanominate pukka film change behaviour universal language film uk international client include bp bt child exploitation online protection centre driving standard agency linde metropolitan police maersk oil uk ministry defence enel health safety executive hess saipem awardwinning drama global organisation improve workplace work practice business mission businesscritical issue address recognise role quality film play ve come right place example work wwwpukkafilmscomwork pukka film develop project film tv produce feature film kajaki true story nominate bafta outstanding debut feature guardian reader film year,LinkedIn - Reported,0,2023-11-01 11:50:17,153,2023,11,1,2,0,11
engineering company consulting service expert report measurement planning area acoustic physics environmental protection,website,0,2023-10-30 01:54:31,19,2023,10,30,0,0,1
commitment sustainable development,website,0,2023-12-12 07:05:06,5,2023,12,12,1,0,7
sky medical develop bioelectronic device integrate onpulse neuromodulation technology prevent treat wide range acute chronic circulatory condition eg prevent venous thromboembolism vte prevention reduction edema surgery heal venous arterial leg ulcer chronic wound speedup recovery time highperformance athlete conduct clinical research onpulse hospital community care center accelerate patient recovery surgery accelerate healing chronic venous diabetic ulcer device olympic usa professional athlete olympic hockey team nfl mls mlb nba d ncaa team nhl club accelerate post training postmatch recovery team include limit ac milan chelsea west ham everton football team golden state warrior new england patriots san francisco er stimulate peroneal nerve neuromodulation believe create natural effect body improve function quality life patient,LinkedIn - Reported,0,2023-10-30 13:34:00,180,2023,10,30,0,0,13
endless printing possibility combine personalized service s command company familyowne fullservice printer forefront print digital innovation,website,0,2023-10-24 05:21:58,22,2023,10,24,1,0,5
doubleday group found john doubleday early s holbeach st johns provide local area quality agricultural machinery,website,0,2023-07-24 04:35:20,24,2023,7,24,0,0,4
website pharmaceutical company ananta medicare information product medicine dietary supplement info ananta news news medicine pharmacy,website,0,2023-10-19 22:06:11,25,2023,10,19,3,0,22
protect company know attack intelligence keep identify unknown attack quickly initiate countermeasure,website,0,2023-07-03 19:54:31,18,2023,7,3,0,0,19
halteres associates llc provide strategic tactical consulting service bioscience organization area diagnostic therapeutic medical device life science research assist organization follow area technology product mapping context competition pro con opportunity analysis base commercial attractiveness technical likelihood success criterion health economic analysis reimbursement strategy clinical study plan include sample bank diagnostic study business modeling financial analysis,LinkedIn - Reported,0,2023-10-31 03:27:07,83,2023,10,31,1,0,3
digital vetting platform leverage technology datum rapidly accurately classify shipment reveal suspicious entity,website,0,2023-07-03 22:32:46,18,2023,7,3,0,0,22
funding growth sustainability find help ireland large independent motor finance company help thousand car buyer purchase new car year learn specialise loan m m provide debt funding professional property owner nationwide learn milkflex awardwinning,website,0,2025-01-22 16:21:12,56,2025,1,22,2,0,16
chicory transform recipe content commerce medium platform power network recipe publisher retailer cpg brand use reach million highintent grocery shopper month chicory contextual advertising shoppable recipe solution find website,website,0,2023-12-05 15:45:59,44,2023,12,5,1,0,15
visit istituto marangoni website information programme fashion art design course milan florence paris london dubai shanghai mumbai,website,0,2025-01-23 11:26:02,23,2025,1,23,3,0,11
line technology use consultative approach align business need right technology visit website learn,website,0,2023-10-24 23:29:08,23,2023,10,24,1,0,23
nxd group experienced successful practical business leader want add value sme business help business benefit involvement quality businessman price small business afford case formal board placement time operate formal position unlike consultant come business recommendation complete task employee gradually lose ability view matter objectively member sit rim business outside consequently bring independent status free thinking willingness think whilst genuinely interested long term success business precise role perform differ business business act experienced sound board opening door make connection provide expert advice help formulate company strategy business plan support process raise funding assist specific task succession planning acquisition exit geographical expansion believe uk business set structure specifically objective bring benefit nonexecutive directorsservice sme differ focus add significant value business work honest walk away believe add value charge placement fee cost efficient normally work basis spend small time long period normally thing help well approach cost efficient ensure improvement own management team sustainable,LinkedIn - Reported,0,2023-08-06 02:37:57,334,2023,8,6,6,1,2
create world portable durable lighting gear desire source inspiration adventurous spirit help capture share lifes beautiful great moment s adventure brand bring light adventure,LinkedIn - Reported,0,2023-08-06 09:41:30,51,2023,8,6,6,1,9
